{"acquisition_count":64,"kind":"ScanFacts","maximum_samples_per_acquisition":64,"physical_channel_count":8,"scan_descriptor_digest":"sha256:aaaaaaaaaaaaaaaaaaaaaaaaaaaaaaaaaaaaaaaaaaaaaaaaaaaaaaaaaaaaaaaa","source_xml_digest":"sha256:bbbbbbbbbbbbbbbbbbbbbbbbbbbbbbbbbbbbbbbbbbbbbbbbbbbbbbbbbbbbbbbb","trajectory_dimensions":0}
